Index,Time,Source,Content
119,2015-05-01T19:30:02+00:00,Kolkata24*7,Kolkata: Two people were killed in two separate road accidents in the city. One of the deceased was an engineering student while the other was an auto driver. The first incident occurred in Prince Anwar Shah Road’s Jibananada Setu where a youth named Apurba Debnath (24) was killed. He was a resident of Tehatta in Nadia district and a student of an Engineering college in Budge Budge.He was on his way from Jadavpur to Kalikapur on a motorbike of a friend when the bike hit the railing on the Jibananda Setu. Both of them were admitted to MR Bangur hospital in a critical condition where Apurba succumbed to his injuries. In another incident an autorickshaw driver was killed when his auto collided head on with a Taxi between Hatibagan and Shovabazar. He was taken to RG Kar Medical College and Hospital where the doctors declared him dead.
120,2015-03-02T12:03:28+00:00,Kolkata24*7,Kolkata: Three students were injured in an accident near Number 1 road of Dumdum Airport on Monday after a government bus rammed their vehicle. The students were going to their respective exam center to appear in the ongoing Srcondary exam in the state.Police rushed to the spot after the incident. The students were administered first aid and sent to their exam centers.
121,2015-02-08T12:26:16+00:00,Kolkata24*7,Kolkata: A seven year child died and nine others were injured in a road accident after a taxi collided with a car in the college Street area of the city on Sunday morning. The child died on the spot while the injured have been taken to nearby hospitals. No further report of any casuality is reported so far.
122,2015-01-30T15:22:24+00:00,Kolkata24*7,"Kolkata: A school student was killed at Behala’s Chowrasta early in the morning on Friday. While crossing the road, she was run over by a bus. Two buses were trying to overtake each other. Not being able to maintain the speed, one of the buses ran into this girl.The girl is a student of the Arts faculty in the Vivekananda Women’s college. She was spot dead. The police have arrested the bus driver."
123,2019-05-05T13:10:49+00:00,Kolkata24*7,"Kolkata: Seven Lok Sabha constituencies spread across three districts in West Bengal will go to polls in the fifth phase of elections on Monday.The ruling Trinamool Congress, the BJP, the Congress and Left Front constituent CPI(M) are the main contenders in the seven seats where the fate of 83 candidates will be decided by a 1,16,91,889-strong electorate.To ensure free and fair polling in Bongaon (SC), Barrackpur, Howrah, Uluberia, Serampore, Hooghly and Arambagh (SC) seats, the Election Commission will deploy a total of 578 companies of central forces, which will cover almost 100 per cent polling booths, officials said. The campaign for these constituencies have seen poll meetings by Prime Minister Narendra Modi, BJP chief Amit Shah and West Bengal Chief Minister Mamata Banerjee. Banerjee also participated in a number of roadshows, including one in the last day. The TMC has fielded Mamata Thakur against BJP nomiee Shantanu Thakur inviting a split in the Matua community in the Bangaon (SC) seat. The CPI(M) has nominated Alakesh Das, while the Congress has fielded Sourav Prosad.Shantanu Thakur was injured in an accident Saturday. Matua votes were considered a major factor in the Trinamool Congress’ win in the 2011 and 2016 Assembly polls. With an estimated population of 30 lakh in the state, Matuas can influence results in at least five Lok Sabha seats in North and South 24 Parganas districts.In Barrackpore, the TMC has fielded Dinesh Trivedi against BJP’s Arjun Singh who defected from the TMC ahead of the polls. The Congress has nominated Md Alam and the CPI(M)’s candidate is Gargi Chatterjee.The Howrah Lok Sabha seat will see footballer-turned- polictician Prasun Banerjee of the TMC locking horns with BJP’s Rantidev Sengupta. The Congress has nominated Suvra Ghosh and the CPI(M) has nominated Sumitro Adhikary.In Uluberia, TMC’s Sajda Ahmed will contest against Joy Banerjee of the BJP. The Congress has fielded Shoma Ranisree Roy and Maksuda Khatun has been nominated by the CPI (M).Kalyan Banerjee is the TMC candidate from Sreerampur against BJP’s Debjit Sarkar. The Congress has nominated Debabrata Biswas and the CPI(M) named Tirthankar Ray for the seat.In Hooghly the seat, Dr Ratna De Nag of the TMC will contest against BJP’s celebrity candidate Locket Chatterjee.The CPI(M) has nominated Pradip Saha and the Congress has fielded Pratul Chandra Saha for the seat.In the Arambagh (SC) seat, TMC’s Aparupa Poddar will contest against Tapan Kumar Ray of the BJP. The CPI(M) has fielded Sakti Mohan Malik and the Congress has nominated Jyoti Kumari Das.Besides general election observers and expenditure observers, the poll panel has for the first time deployed a special police observer and a special observer.In another first, VVPATs will be used in all the polling booths along with the EVMs, EC sources said."
124,2019-05-04T18:52:22+00:00,Kolkata24*7,"Kolkata: The high-pitched campaigning by different political parties for seven Lok Sabha constituencies going to the polls in the fifth phase on May 6 came to an end Saturday evening.The campaigning during the last couple of days was marred by the panic over Cyclone Fani, which caused large scale destruction in neighbouring Odisha. The fear over the calamity led all political parties to cancel their election meetings. On the last day of campaigning the BJP candidate of Bongaon(SC) seat, Shantanu Thakur was injured in a road accident.Seats in which elections will be held on Monday are Bongaon(SC), Barrackpur, Howrah, Uluberia, Serampore, Hooghly and Arambagh (SC) where an electorate of 1,16,91,889 will decide the fate of 83 candidates, the Election Commission said. The EC will deploy a total 578 companies of central forces, which will cover almost 100 per cent polling booths in the seven constituencies to ensure free and fair polling, officials in the poll body said.All the seven seats, which are spread across North 24 Parganas, Howrah and Hoogly districts and parts of Nadia district, will see a four-cornered contest between Trinamool Congress, BJP, Congress and the Left Front major CPI(M).The campaign saw poll meetings by Prime Minister Narendra Modi, BJP president Amit Shah and West Bengal Chief Minister and Trinamool Congres supremo Mamata Banerjee. Banerjee also participated in a number of roadshows.In Bongaon(SC) seat, which is on the Indo-Bangla border and has a large number of voters from the Matua community, TMC has fielded Mamata Thakur against the BJP candidate Shantanu Thakur. The Left Front constituent CPI(M) has nominated Alakesh Das, while the Congress has nominated Sourav Prosad.The Matuas (Namasudras) are a closely-knit scheduled caste group with presence in five parliamentary seats in North and South 24 Parganas districts of West Bengal, making them one of the biggest vote banks in the state. Shantanu Thakur is the grandson of the late Matua matriarch Binapani Devi, while Mamata Bala Thakur is her daughter-in-law.In Barrackpore, the TMC has fielded its sitting MP Dinesh Trivedi against BJP’s Arjun Singh, who had defected from Mamata Banerjee’s party ahead of the poll. The Congress has nominated Md Alam and CPI(M) Gargi Chatterjee.Howrah Lok Sabha seat will see TMC’s Prasun Banerjee, a footballer-turned politician locking horns with BJP’s Rantidev Sengupta. Congress has nominated Suvra Ghosh and the CPI(M) Sumitro Adhikary.In Uluberia seat TMC’s Sajda Ahmed will contest against Joy Banerjee of BJP. The Congress has fielded Shoma Ranisree Roy and CPI(M) Maksuda Khatun. Kalyan Banerjee is the TMC candidate from Sreerampur seat against BJP’s Debjit Sarkar. The Congress has nominated Debabrata Biswas and CPI(M) has fielded Tirthankar Ray for the seat.In Hooghly seat Ratna De Nag of TMC will contest against BJP’s celebrity candidate Locket Chatterjee. The CPI(M) has nominated Pradip Saha and the Congress Pratul Chandra Saha for the seat.In Arambagh(SC) seat, TMC’s Aparupa Poddar will contest against Tapan Kumar Ray of BJP. The CPI(M) has fielded Sakti Mohan Malik and Congress Jyoti Kumari Das.Braving inclement weather due to Cyclone Fani, the polling personnel have already left for the 13,290 booths in the seven constituencies.Besides general election observers and expenditure observers, the poll panel has for the first time deployed a special police observer and a special observer.In another first, VVPAT will be used in all polling booths along with the EVMs, EC sources said."
125,2019-02-19T19:04:26+00:00,Kolkata24*7,"Kolkata: A five-year-old school girl was on Tuesday run over by a speeding bus in front of her mother in the Dum Dum area of North 24 Pargana district in West Bengal, police said.The incident took place on the Jessore Road in Dum Dum’s Nagerbazar around 10 a.m.“Anushka Kar was run over by a private bus while on her way to school. She was declared brought dead in the hospital,” an officer from Dum Dum police station said. According to the eye-witnesses, the girl got down from a bus along with her mother near the Nagerbazar bus stop. She was run over by the same bus before she could step aside.Police have seized the bus but the driver fled from the spot.Following the accident, a group of angry guardians blocked the road to protest against rash driving in the area. They also protested at the school accusing it of not providing sufficient number of school buses for students.“The school authority has no responsibility. They have very few school buses. As a result, many of our kids have to travel in private buses. They should immediately post some attendants outside the school premises for safely escorting students,” a guardian said."
126,2019-01-19T15:00:29+00:00,Kolkata24*7,"Modi is unable to take everyone along. One who can’t take everyone along, can’t be a leader. This is the beginning of BJP’s endHaven’t seen anyone run a country in a such a fascist manner,” said Mamata Banerjee, while ending her speech with “BJP hatao, desh bachao and Jai Hindh, Vande mataram” chant. A new government will be formed at the Centre. It is inevitable. Their expiry date has come. This is people’s verdict:A new government will be formed at the Centre. It is inevitable. Their expiry date has come. This is people’s verdict:A new government will be formed at the Centre. It is inevitable. Their expiry date has come. This is people’s verdict:They are some goody goody people: MamataThey (BJP) want riots in West Bengal. They want to do rath yatra. I will not allow this to happen. I wont let riots happen in West Bengal: Mamata Banerjee, West Bengal CMThey humiliated CBI, ED, RBI. They undermined banks. Remember, if you vote BJP to power this time, you won’t get any of your money back, said Mamata Banerjee.They are doing politics even with the security forces: Mamata Banerjee, West Bengal CMThere is no need to discuss our PM candidate right now: MamataThe credibility of CBI has been destroyed:MamataWe will work together to bring a new dawn for the country:Mamata22-23 parties have taken part in this rally. The Modi government is past is expiry date,” said Mamata BanerjeeMamata Banerjee speaks at opposition’s ‘United India’ rally in Kolkata “This rally will rob Modiji of his sleep. I want to tell Modiji, you can be chowkidaar, but people of this country are thaanedaar (cops),’ said Tejashwi Yadav.We are not afraid of intimidation tactics. We have to save the country”: Tejashwi YadavPromises and Performance mein gap hai: Shatrughan Sinha“Mood of the nation is Parivartan. Parivartan. Parivartan. People want a new leadership” Shatrughan Sinha said. “It is a herculean task to forget differences and come together,” says former PM HD Deve Gowda.Former Prime Minister HD Deve Gowda says: “The Centre is victimising leaders of Opposition parties using all machinery”16 million people have lost jobs: KhargeFarmers are dying but PM Modi is feeding people like Anil Ambani, says Mallikarjun Kharge.Mallikarjun Kharge reads a message from Sonia Gandhi: “The upcoming general elections will be on the faith of restoring democracy in our country”We want to protect interests of the youth, women and farmers. BJP leaders said we will fight for the PM’s post, but we have gathered to save the country,” said Sharad Pawar. EVM is a big fraud, we have to go back to paper ballot,” he added.This government is not controlling inflation but interfering in federal work. If you misbehave in Karnataka, you will pay a heavy price.The BJP and NDA have betrayed the nation. This government is doing fraud by paying extra for 36 jets. It has misled the nation in this case.This Prime Minister is a publicity PM, not a performing PM: Chief Minister of Andhra Pradesh“We have only one mission – Save India. Save democracy.”: Chief Minister of Andhra PradeshChief Minister of Andhra Pradesh says: “We have only one mission – Save India. Save democracy.”People ask me about the alternate to Modi, I would like to tell them that 2019 polls should be aimed at removing Modi and Amit Shah” says Arvind Kejriwal Today is a historic day for the country. The Shah-Modi duo have destroyed the country”: Arvind Kejriwal SP and BSP has united now against BJP. We have tried to bring the parties together and this has made BJP very insecure:Akhilesh YadavWhat starts in Bengal is seen all across India,” says Samajwadi Party chief Akhilesh Yadav in Kolkata Salute the soil of Bengal. Bengal will lead from the front under the leadership of Didi: YadavJo baat Bengl se chalegi, woh desh mein dikhai degi”: Akhilesh YadavThe BJP has dictatorial attitude. The country, today, is at crossroads because of their policies,” said HD Kumaraswamy. H D Deve Gowda taught me to be humble and simple like Didi says Karnataka chief minister.Senior Congress leader Mallikarjun Kharge takes the stage at Mamata Banerjee’s United Opposition Rally.Chief Minister of Karnataka, kumaraswamy, says: “Regional have the strong instinct to connect with the people and protect the interests of their States.”“Stalin will sweep the elections, he may win all the seats. Congratulations to him, in advance,” said host Mamata Banerjee at the mega rallyHitting out at prime minister Modi, MK Stalin said, “Mamata is one person Modi is afraid of.” “Wherever PM Modi is going he is fiercely attacking the Opposition, Modi is fearful of Opposition and that is why he is also cursing us, he is afraid of our unity, we must come together to safeguard India,” he added. Before coming to power Modi promised a lot of things but he has failed to fulfill all the promises: MK StalinIf we Unite together then we will win definitely: MK StalinThe upcoming general elections in May will be the second freedom struggle of the country”: MK StalinIt will be decided later who becomes PM, first we have to fight the elections together: Farooq Abdullah“Every Kashmiri wants to stay with India, they want to live and die together. I urge you to participate with us. We have to fight the polls together”: Farooq AbdullahFormer Chief Minister of Jammu & Kashmir, Farooq Abdullah, says: “The BJP is dividing people on the basis of religion. We must all come together to defeat the divisive forces” Not one institution is left, which has not been destroyed by the current govt at CentreFormer MP Sharad Yadav: Financial loss due to demonetisation, country in serious situation At this rally, I am seeing a rainbow of 22 parties is replacing dark cloudsRajya Sabha MP Dr AM Singhvi says: “Clouds are parting. A rainbow of political parties is forming. The time for a coalition has arrived”Abhishek Singhvi: Amar antorik shubhechha nioThere should be only one motto, to defeat BJP. Fight 1 vs 1 against the BJPNothing like Rafale scam happened beforeHe speaks on demonetisation and GST, criticises it harshlyFormer Union Minister Arun Shourie says: “No other government has said so many lies. Never before were institutions undermined in this manner”Not a fight against any individual, but the democracy of the country has fallen apart. Democracy suffers losses in 56 monthsWe are united here to remove the PM – YashwantFormer Union Minister Yashwant Sinha says: “This is not about removing one man from power. We have come together to defeat an ideology.”Ami tomader bhalobashi – Jayant“What Bengal thinks today, India thinks tomorrow. Mamata Didi has shown it today”Modi must be ousted to bring ‘acche din’Country wanted a united like this : RLD leader Jayant Chaudhury Let us unite together and fight against communalismThey are interfering with our personal lives, telling us what to eat and what not.Laldu lashes out at Modi govt, Pic Courtesy: AITCIf bill (citizenship amendment bill) is enacted, India will no longer be a suitable place for us to remain. We come here with a purpose, to see a new rule at the centre- Mizoram CM Laldu Hawama Warns ModiGegong Apang, former CM of Arunachal Pradesh says: “The last four years have been testing times for Indian democracy”People of Delhi divided the country, esp the north-eastThe diamonds of the country are present at the brigadeNorth East people also want this, this is their demandHave worked under Indiira, Rajiv Narosima, Monmohan Singh, Devegowda. All believe in federal democracy.It is voice of North-East where the sun first risesGegong Apang, former CM of Arunachal Pradesh Pic courtesy: AITCIt is gatbandhan, all regional parties should work together to save democracy and the people of the country – Gegong Apang speaksEven as leaders are addressing the crowds at United India At Brigade rally, people are still on their way to the venue. People are coming from Howrah via ferriesWill have to maintain the unity of the country: HemantaRegional parties have come together, will have to stand for Dalits and other oppressed communities: Hemanta SorenContinuous attacks on Democracy: JigneshRSS and BJP must be defeated in 2019: JigneshDestruction of democracy shows what we are going through: JigneshIndia going through an unprecedented cricis- Jignesh MehwaniJignesh Mehwani starts his speech with ‘Ami tomake bhalobashi’“Subhas babu lare the goro se, humko larna hai choro se”- Hardik‘Will have to oust miscreants from country, will have to fight against thiefs– HardikHARDIK PATEL starts his speechMamata welcomes Akhilesh, Stalin and other leadersMamata speaks in Bengali and Hindi.Mamata announces Brigade rally to begin earlier.Poet Srijato recites one of his poems.People are arriving at Sealdah station. All roads lead to United India At Brigade rally todayKabir Suman singing at BrigadeFormer CM of J&K Omar Abdullah reaches Kolkata.Traffic moving at sloth-like speed.Crowd is swelling by the minuteTime: 10:51 am: Chief Minister Mamata Banerjee reaches Brigade ground for the mega anti-BJP rally.Pic courtesy: AITCCultural programme begins at Brigade rally, just waiting for Mamata’s arrival.Poet Srijato present at the Brigade ground.Mamata Banerjee leaves from her Kalighat residence for the Brigade parade grounds.Mamata Banerjee to leave for Brigade grounds shortly.Delhi chief minister Arvind Kejriwal arrives in Kolkata for the mega anti-BJP rally.Among the other leaders attending the event are Karnataka Chief Minister HD Kumaraswamy, Delhi Chief Minister Arvind Kejriwal, Andhra Pradesh Chief Minister N Chandrababu Naidu, National Conference leader Omar Abdullah and Rashtriya Janata Dal leader Tejashwi Yadav.“Only few hours to go for the historic ‘United India Rally’ at Brigade Parade Grounds. I welcome all national leaders, supporters and lakhs of people to participate in today’s rally to pledge to build a stronger, progressive and united India” – tweets MamataAt around 9 am, a major accident occured near Central Park. Bidannagar police commissionerate detective head injured in the incident. Rushed to the hospital.Followers and supporters start assembling at Brigade parade grounds. Kolkata: Kolkata’s Brigade Parade Ground is all set to host Trinamool chief Mamata Banerjee’s mega rally for a grand alliance of opposition parties this noon, with political leaders from all corners of the country joining in.Among the first to make an appearance were Samajwadi Party leader Akhilesh Yadav, DMK chief MK Stalin, former BJP leader Arun Shourie, Loktantrik Janata Dal chief Sharad Yadav and Nationalist Congress Party head Sharad Pawar.At least 25 top political leaders are expected to occupy the stage at the event — called the “United India Rally” — aimed at uniting various political parties against the Narendra Modi-led BJP in the upcoming Lok Sabha elections. Ms Banerjee, also the Bengal chief minister, spent several hours on Friday interacting with visiting political leaders put up at various hotels across the city."
127,2018-12-14T02:12:53+00:00,Kolkata24*7,"Kolkata: Four-time Olympic Games gold medalist and diving legend Greg Louganis, International Event Ambassador of Tata Steel Kolkata 25K this year has graced the City of Joy today.“It’s very exciting. I admire the people who are here and going to be a part of the 25K race. Fitness is a part of life. Whether it’s diet or exercising you need to take up,” Greg said about the spirit of Tata Steel Kolkata 25K. Greg will flag off India’s only international 25K on 16 December which also celebrates Vijay Diwas as well. Greg can boast a total of 17 global gold medals to his name; including four from the Olympics, five world championships, six Pan American titles and two from the World University Games. The 1988, Seoul Olympic is famous for Greg&#39;s commitment to the game and fighting spirit. During the qualifying, he hit the back of his head on the diving board requiring several stitches, an accident that should have been competition ending.However, he came back to sweep gold in the 10m platform and also in the 3m springboard, leaving global audiences dumbstruck. About the Seoul Olympic incident and what motivated him to for the next dive Greg said: “My inspirations were Ryan White and my coach who just been there and been supportive. When I hit my head on the springboard there was so much going on. I was diagnosed with HIV positive, my coach’s mother was in coma and he didn’t know whether to stay or go home. He decided to stay with us. Both of us were rather distracted and I was the favourite but in split second after hitting the board I suddenly became underdog. I was focused and tried to do my absolute best.” With gold medals at the 1984 (Los Angeles) and 1988 (Seoul) Summer Olympics, on the springboard and platform, he is also the only male diver to sweep both diving events in successive Olympics.Being a diver how Greg feels about distance running which is an event based on timing he said: “In a road race where you have the camaraderie of the people around you, you have the similar goals and aspirations, so that can be inspiring. But if you are way ahead then that shouldn’t limit you as to how successful can you be. Rather than looking at the clock feel within your body, your heart, your soul so I think that there are many elements of competition, a performance however you want to look at it. Because maybe a competitor that’s right next to you that you will never beat in your life but you are there as companions to help each other through. So it really does become a community effort and it can be such an incredibly special moment to share that with someone because not everybody can run like that.” “You have to train for it, you work and all of a sudden your work pays off and you gotta feel good about what you are doing. That’s why when I mentor USA diving, swimming and many different sports it’s not so much about the end result. It’s about am I better today than I was yesterday? And if you can honestly say that then everyday is different. We all have bad days. Those bad days are the days where you learn a lesson. Don’t be so close that you don’t use that lesson. Not my every competition was stellar but what happened was there’s always something I could take away from that whether successful or not. That enables me to do better and move forward to the next time,” he added. After his retirement from competition in 1989, the 58-year-old American has donned many hats and always continued his commitment to excellence. He has become a mentor and coach to many top divers including members of the 2012 and 2016 US Olympic teams, a motivational speaker, author, actor, LGBT rights activist, humanitarian and an HIV/AIDS awareness advocate and designer."
