Index,Time,Source,Content
139,2018-07-13T20:20:01+00:00,Kolkata24*7,"Kolkata: The Transportation department of West Bengal on Friday has announced a salary system for privatised bus drivers and conductors from August 1, 2018.A system considered to be the biggest contributor to reckless racing of buses. Minister Suvendu Adhikari announced the decision after a meeting with senior transport department officials, senior police officers and bus, minibus and taxi operators. The minister at the meeting said the salary system would become effective within soon.Earlier, it was said that the abolition of commission system, experts said, will free the entire bus operation system from the clutches of workers’ union. “Bus workers’ unions efficiently decide the duty roster of bus labourers and supply drivers and conductors if the regular drivers or conductors skip duty. The abolition can be a disruptor of a well-oiled system, if workers unions are not taken into confidence during the implementation,” said transport economist Aniruddha Sarkar.Significantly, buses are the biggest contributor to accidents on city streets. In the current system, the driver and conductor earns a percentage of the day’s total earning as their remuneration. As more passengers translate into greater income for the drivers and conductors, this system, police said, makes drivers reckless to pick up extra passengers, making the roads unsafe for all commuters.Adhikari on Thursday constituted a steering committee with senior transport department officials and senior police officers, which will oversee the smoother implementation of the abolition process and transition to the salary system.Significantly, the commission system prevails in five districts in greater Kolkata region — Kolkata, North & South 24 Parganas, Howrah and Hooghly. In the rest of the district, the salary system is in use.Transport department will also prepare time table for every route, so that buses are evenly distributed. If necessary, routes will be rationalised so that each bus can earn enough to sustain the trade, said a transport department source.Subhas Chakraborty and Madan Mitra as transport ministers had earlier tried to abolish it. The operators have now demanded guidelines from the state. “We will pay the salary but who will ensure that buses will be run on roads,” said Tapan Bandyopadhyay of Joint Council of Bus Syndicates."
140,2018-06-20T04:23:40+00:00,Kolkata24*7,"Kolkata: A brave father has come up to donate his son’s organs, who was supposed to donate his own. Pretty shocking! But true. Cruel twist of fate, once father told his son to donate his organs when he dies, but on Tuesday afternoon in a tragic accident in Upen Banerjee road of South Kolkata unfortunately the son lost his life. The deceased Trijit Ghosh, age 26, was hit by a bus while he was riding on his two wheeler.Reportedly,the incident took place on Tuesday afternoon, the 26 year old was the resident of Kalighat Nepal Bhattacharya Road. On this day he was hit by a bus near Upen Banerjee road near Parnashree police station while he was two wheeler, he was seriously injured, soon the police took him to the Behala Vidyasagar Hospital.But the doctor declared him dead. After getting the news, his father Snehasis Ghosh reached the hospital.Father of the deceased Trijit while talking to a doctor, broke down in tears. There he said something which made everyone shocked. He said that it was not supposed to happen. “It was me whose body was supposed to be donated by my son Trijit.” But it is the cruel twist of fate that today the bereaved father is going to donate his son’s organs. Soon the administrative procedure was started.In the night around 9pm with the help of Green corridor his body has been brought to the SSKM Hospital. Snehasis Ghosh first donated his son’s two eyes, and the skin to the Health Department Of West Bengal. Meanwhile, his eyes are kept in Eye Bank. Trijit’s eyes will be transplanted to someone, and Trijit will see the world again through their eyes, hopes the bereaved father of the 26 year old. Reported by: Subhash BaidyaEdited by: Mousumi Das"
141,2018-06-08T16:21:28+00:00,Kolkata24*7,"Suprio Ray, Kolkata: An accidental shooting in the broad day light at Dum Dum metro station creates panic. The firing took place by a RPF jawan during handing over taking charge the rifle went off. A 9 year old boy along with his mother and a metro rail staff were injured.Reportedly, on Friday afternoon at Dum Dum metro station while a RPF jawan after getting off from his duty was handing over his service rifle(slr)to his colleague who was on duty.“During the handing over taking charge the loaded rifle went off,the bullet touch the ground and the splinter hits three. Saptarshi Basu 9 year old boy along with his mother and a metro rail staff were injured.Immediately they were sent to the RG Kar Hospital,” says CPRO Indrani Banerjee. “She further added that strict action will be taken after the inquiry report comes out.” As per sources,all three injured are out of danger now and they will be discharged soon. A high level inquiry will be done on this incident. The matter has been informed to Sinthi police station as the post office falls under it.Edited by: Mousumi Das"
142,2018-05-29T23:25:54+00:00,Kolkata24*7,"Kolkata: A 3.5-feet-long iron rod was successfully removed by doctors in Kolkata from the skull of a youth.The 24 years old Tarikh suffered severe brain damage after the metal pierced through his forehead and the cranium in a car accident. The patient discharged on Tuesday.“Tarique suffered a car accident on April 28 in which a 3.5 ft long iron rod of the roadside divider broke and went through his forehead leaving him profusely bleeding and with very little life expectancy when he was brought to the hospital,” said Binod Kumar Singhania, consultant neuro surgeon at the hospital. “The case was extremely tricky as the biggest challenge was to minimise the bleeding inside the skull after removing the metal rod. As the brain remains enclosed inside the skull, too much bleeding could have damaged a large number of brain cells that may have led to the patient’s death,” the doctor said.The doctor revealed they had to get on with the surgery without much prior knowledge about the extent of the patient’s brain damage as it was difficult to conduct a CT scan with such a big piece of metal stuck in his head.They eventually removed the rod through a unique endoscopic process with proper haemostasis — a process which causes bleeding to stop. Singhania admitted that he hasn’t performed such an operation in his 30-year-long career as a neurosurgeon."
143,2018-05-23T11:04:00+00:00,Kolkata24*7,"Kolkata: Dilchand Singh who had undergone heart transplantation at Fortis Hospital in Anandapur off EM Bypass on Monday, is stable now.“The heart transplant recipient is stable and continues to progress well,” the Press statement issued by the medical superintendent of the hospital said. The patient will be kept under observation for the next few days.A Press statement issued by the private hospital authorities on Tuesday said that the patient has been recovering well and has been taken off assisted ventilation. Kolkata Police created a green channel in peak traffic hours for a heart which was harvested from a brain dead person in Bangalore and flown to Kolkata airport. This is the case of first such heart transplant surgery in north-eastern India.The heart donor Varun Beekay died in a road accident in Bengaluru. After this, the family members of the deceased expressed their desire of heart donation. The hospital authorities immediately contacted Malhar Fortis Hospital in Chennai."
144,2018-05-21T17:07:11+00:00,Kolkata24*7,"TOI Kolkata: Chingrighata footbridge to become safer for locals and motorists. The accident-prone Chingrighata crossing may get safer for both locals and motorists with the KMDA starting construction of the first of the two proposed foot overbridges (FOB) at Captain Bhery, metres away from the Chingrighata flyover.According to the TOI report the FOB has been a consistent demand by locals after the stretch witnessed several fatal accidents this year. Kolkata Police too, has been continuously following up with the civic agency to get the plans executed. “Once the FOB becomes operational, we will dismantle the traffic lights at Captain Bhery in order to ease the commute,” said a senior Beliaghata traffic guard official.But this is not the only change at the accident-prone stretch of EM Bypass between Science City and Chingrighata crossing. In an effort to stop vehicles from bumping into one another on the north-bound flank of EM Bypass near Metropolitan, Kolkata traffic police has introduced two new signals — one right after motorists get off the Maa flyover and the other at the Avani cut out close to Metropolitan. “The road shrinks at this point and we often find vehicles coming from Science City jostling for space with cars speeding down Maa flyover. This had led to accidents in the past,” explained a senior officer at Lalbazar.For now, thus, vehicles getting off Maa flyover will be stopped for a maximum period of one minute to allow those vehicles using the Bypass to move ahead. The vehicles on the service lane will also have to stop for the same amount of time in order to allow vehicles from Science City to move towards Chigrighata. Once these 60 seconds elapse, the vehicles from Science City will be halted for a maximum of 30 seconds to allow vehicles from Maa flyover and the service roads to pass.“The plan is to allow one lane of vehicles to continue forward even as we keep another lane on hold. This is the only option available to control the volume of traffic on this stretch. This concept was introduced on the Santragachhi flyover with great success,” said DC (traffic) Sumit Kumar.The second overbridge will be built at the Chingrighata intersection to cross over Bypass from Chaulpatty Road to Jal Vayu Vihar. KMDA might install an elevator and an escalator at the FOB to facilitate cyclists and those who may have difficulty using the stairs."
145,2018-04-10T09:48:30+00:00,Kolkata24*7,"Kolkata: The West Bengal State Election Commission (WBSEC) issued a notification extending the last day of filing nomination papers for panchayat polls by another day.State Election Commissioner A K Singh had agreed on Saturday that there were “problems” in some areas over filing of nominations for the panchayat polls and had requested 171 block-level observers to be “impartial” while sending reports so that the panel can ensure free and fair polls.Panchayat polls are scheduled to be held in three phases, on May 1, 3 and 5. The results will be declared on May 8. ADG (law and order) Anuj Sharma said, “All booths will have armed forces during all three phases of election.” While South 24 Parganas, Nadia, Cooch Behar, Murshidabad and Kolkata districts faced clashes, one Congress candidate was killed in a road accident in Malda, which led to a demonstration by local residents.Over the past few days, Opposition parties have relentlessly accused the ruling Trinamool Congress of not allowing their candidate to file their nominations. TMC, in turn, has been denying the allegations.Trinamool Congress general secretary Partha Chatterjee said, “On one hand they take out armed rally, on the other hand they are complaining to the Election Commission that they are not able to file nominations because they are being attacked. It is evident that the entire thing is planned. Places where they don’t have existence, they are saying they were not allowed to file nominations. No democratic person will give importance to such allegations. If these allegations are true, then how have so many nomination forms been filed by the opposition parties? Till yesterday, 49 per cent of nominations were filed by Opposition.”During a press conference held on Monday, BJP state president Dilip Ghosh said, “Women being manhandled, heckled over filing nomination has never happened in Bengal and they are proud of this. They are saying Opposition has zero existence by not allowing nomination process. Our people couldn’t file nominations, they have been beaten up, thrashed in different parts of the state. They were stopped from filing nominations. State government has not been in favour of deployment of central forces.”"
146,2018-04-02T12:32:56+00:00,Kolkata24*7,"Kolkata: The Calcutta High Court on Monday announced a stay order in the ongoing murder case against BJP leader Mukul Roy in relation to a complaint over the death of his political mentor, Mrinal Kanti Singha Roy, in January 2015.Mukul Roy, who was then a Trinamool Congress Rajya Sabha MP, was directed by the court to cooperate and appear before the investigating officer as and when asked. The HC directed the state to produce all medical records relating to the treatment of Singha Roy and his death certificate on February 14, the next date of hearing.Mukul Roy had moved for anticipatory bail before a division bench of justices Joymalyo Bagchi and Rajarshi Bharadwaj. Appearing for Roy, his lawyer Asish Sanyal said Singha Roy had met with an accident in 2011 and died in 2015. Singha Roy had allegedly met with a road accident on June 8, 2011 around midnight while returning home at Kanchrapara from Halisahar. Singha Roy’s sister Sonali alleged that he was shifted to a Kolkata hospital and, then, was kept in a lodge under instructions of Roy instead of being taken home after his release."
147,2018-04-01T22:42:19+00:00,Kolkata24*7,"Kolkata: The cyclonic storm on Sunday has turned over a jumping ballon in Eco Park where five children have been dragged on the road. The incident took place in the evening around 7:30 pm.Local police and park authority rescued the children for treatment and rushed to a private hospital on Eastern Metropoliton Bypass. Hospital authority has released them after a first aid process. Two of them are critically injured among them.Eco park authority has said, approximately ten children were there on the ride. Most of them are under 10 years. কালবৈশাখীর ঝড়ে ইকো পার্কে দুর্ঘটনা, আহত বহুHIDCO has assured an investigation on the condition of the ride and why such incident took place in the park."
148,2018-03-24T22:30:54+00:00,Kolkata24*7,"Bidhannagar: A middle-aged man has been mowed by a train in Kolkata while he was crossing the railway line with a headphone plugged to his ears at Bidhannagar station on Saturday.কানে হেডফোন, লাইন পার হতে গিয়ে মৃত্যু প্রৌঢ়েরThe mishap took place between Bidhannagar Road (Ultadanga) and Dum Dum railway stations around 8 am when Santipur local passed away. Eyewitnesses said the 55-year-old man was crossing the railway line near Bidhannagar Road station. The mishap disrupted train movements on the route for a while until the Government Railway Police personnel removed the dead body from the railway tracks."
149,2018-03-15T10:24:42+00:00,Kolkata24*7,"Kolkata: A 60-year-old senior professor of the Indian Statistical Institute died after he was hit by an unidentified vehicle on Wednesday evening while boarding an auto. The incident took place outside ISI campus on BT Road.Chivukula Anjanea Murthy, residing at 211 BT Road C A Murthy was associated with the ISI’s Machine Intelligence Unit. Born in Andhra Pradesh’s Ongole, Murthy spent his student years — UG to PhD — at ISI Kolkata, which he later joined as a professor.According to a Preliminary reports that suggest that he sustained a head injury and was declared brought dead at the hospital. Police said they have been told several versions of the accident. According to one, the professor fell while boarding an auto and the rear wheels hit him. Another version said a second vehicle hit him when he was boarding the auto."
150,2018-03-06T17:49:24+00:00,Kolkata24*7,"Kolkata: The New Town Kolkata Development Authority will impose a ban on cattle straying on the roads to prevent accidents.The assembly passed an amendment to the existing Act for the purpose on Tuesday. Urban Development Minister Firhad Hakim said that cattle from neighbouring areas were causing nuisance and were becoming potential threat to road safety.Many residents and road users say that they literally serve as “speed breakers” for motorists, hindering the road traffic on many busy routes. In some places, the driver or occupants have to get down from their vehicles to clear the stray cattle on the road. There are instances where they attack children and women, creating a sense of fear among them. The Minister said that cattle straying into the area would be seized and kept in an enclosure to be created for cows and goats. According to the Bill, such free influx of cattle within the periphery of the New Town needed to be controlled to ensure safety of the citizens.A section of cattle owners consider the city roads as sheds. The cattle invariably occupy the roads from evening to morning. Kolkata Development Authority Act, the Bill also contained provisions that no person would be allowed to use any land within the area for keeping horse, cattle, pig, dog or any quadruped or any kind of bird for any purpose."
151,2018-02-14T19:51:33+00:00,Kolkata24*7,"Kolkata: The Calcutta High Court on Wednesday extended an interim order, preventing the West Bengal police from arresting BJP leader Mukul Roy till March 31 in connection with a complaint over the death of a man in 2015.The court extended the interim order after the West Bengal police moved a plea, seeking more time to find the documents related to the treatment and death of Mrinal Kanti Singha Roy. Singha Roy is considered to be a mentor of the BJP leader during his initial days in politics.While hearing the anticipatory bail prayer moved by the BJP leader, a division bench of justices Joymalyo Bagchi and R Bharadwaj granted the state time till March 15, when the matter will be taken up by the court again. Roy, who was a top Trinamool Congress (TMC) leader before joining the BJP, was earlier directed by the court to cooperate in the probe by the state police and appear before the investigating officer as and when asked. The bench had, on January 30, directed the state to produce all he medical records relating to the treatment of Singha Roy.Singha Roy had allegedly suffered a road accident around midnight on June 8, 2011 while returning home at Kanchrapara from Halisahar in North 24 Parganas district. He was treated at a local nursing home and then shifted to a private hospital in Kolkata.His sister Sonali Kundu had alleged that Singha Roy was made to stay in a lodge under Roy’s supervision after his release from the Kolkata hospital. During his stay at the lodge, Singha Roy suffered a throat infection and died after a prolonged treatment at a city hospital in January 2015, Kundu had said in her complaint.She had also claimed that she found out from the hospital that Singha Roy had suffered an internal haemorrhage and expressed suspicion regarding the role of the BJP leader in the matter.The lawyers representing Kundu told the court that her attempts to lodge a complaint had failed and that she was forced to move the local court, which then directed the police to file an FIR."
152,2018-02-07T21:59:41+00:00,Kolkata24*7,"Kolkata: OC Traffic Of Beliaghata has transferred by Lalbazar due to Chingrighata bus accident. OC Traffic Guard Pankaj Kumar Ghatak was transferred to the lalbazar control room due to negligence. Additional OC of Beliaghata traffic guard Debraj Nahata is taking in charge of OC traffic guard. Along with Debraj, Assistant commissioner Prasenjit som is also handle the traffic guard duties.চিংড়িহাটায় দুর্ঘটনার জেরে সরিয়ে দেওয়া হল ট্রাফিক গার্ডের ওসিকেDC Traffic Sumit Kumar said that the OC has been transferred due to administrative changes. Earlier, following the death of two youths in a road accident on Saturday morning, tensions prevailed at Chingrighata area in Kolkata after agitated crowds torched at least four buses. According to police sources, vehicles have been torched by angry mob after a speeding bus, which was heading towards Salt Lake, mowed down two students who were riding bicycles at 11.15 am in the morning. The students, reportedly, died on the spot.The deceased have been identified as Biswajit Bhuiyan and Sanjoy Banu.It is reported that the bus suddenly tried to take a u-turn, and in the process, mowed down the two students. The traffic movement on EM Bypass has been affected by the incident. Also, Garia to Ultadanga route has been blocked."
153,2018-02-03T23:55:20+00:00,Kolkata24*7,"Kolkata: The West Bengal Government has asked the police to take more action against the drivers who uses mobile phone while on driving. State takes this hard initiative after Murshidabad tragedy.ড্রাইভিং সিটে বসে মোবাইল! নতুন আইন প্রয়োগের নির্দেশ রাজ্যেরA new notification from West Bengal transport department has stated that all drivers who uses mobile phone while on driving, faces 184 section instead of 218(2) section. In this act uses mobile phone on driving served as ‘Dangerous Driving’. The penalties in this section are ten times higher than before and suspends license from for three months. State officials think that mobile phone causes accident while it uses on driving. The new rule issued on Friday night and circulated in all police stations. The rule implemented all over the state. According to DC traffic Sumit Kumar, this act is much harder than before.The matter has been taken in view of steps required for road safety and state government has taken some following measures-Considering the safety of passengers, the offence of using mobile phones while on driving may also attract the penal provisions under section 184.The offence of using mobile while on driving vehicle may be punished with holding driving license or revocation of his license under section 19.Reported By-Sujoy PalEdited By- Piku Mukherjee (Argha)"
154,2018-02-03T11:35:20+00:00,Kolkata24*7,"Kolkata: A bus have smashed two young at Chingrihata Crossing. They were crossing the road with by-cycle.Reportedly, the bus driver has violated the traffic rule. He took the right turn towards Salt Lake Sector-V when the signal was red. The victims are Biswajit Bhuiyan and Sanjay Banu of Shanti Nagar,Naobhanga,Bidhannagar.This incident collapsed the entire Eastern Metropoliton Bypass. বাসের চাকায় পিষ্ট দুই যুবক, রণক্ষেত্র চিংড়িঘাটা Local people have vandalised the bus and police car. Agitated locals protest as adequate number of police are not there to tackle the situation.As a result a good number of local people pedestrians started showing their agitation and started pelting stones & bricks. The wind screen of one Govt. Bus of route no. S-30 was ransacked and three other buses were set on fire on E.M. Bye-pass adjoining PSs have been asked to remain present along E.M. Bypass. DC, SED is also on way to the spot with force.Both the injured persons were removed to NRS Hospital and declared brought dead there.Police have lathi-charged on the agitated locals. Fierce situation at the spot."
155,2018-01-31T09:14:46+00:00,Kolkata24*7,"Kolkata: The Calcutta High court directed police not to arrest BJP leader Mukul Roy in relation to a complaint over the death of his political mentor Mrinal Kanti Singha Roy. The incident took place in January 2015. High Court verdict issued on Tuesday, 30 January,2018.Mukul Roy who was a then a Trinamool Congress Rajya Sabha MP, was directed by the court to co-operate and present before the investigating officer when asked. HC directed the state to produce all kind of medical records relating to the treatment of Mrinal Kanti Singha Roy and his death proof on February 14, the next of hearing.Roy’s lawyear said, Singha Roy had met death in 2011 and died in 2015. The FIR against Roy was the worst kind of political conspiracy. Reportedly, the FIR was lodged by the orders of a magistrate under 156(3) CrPC. Police was just abiding by the court order.Mrinal Kanti Singha Roy was allegedly faced a road accident on June 8,2011 around midnight while returning home from Kanchrapara to Halisahar. His sister alleged that, he was shifted to Kolkata hospital and then kept in lodge under the instructions of Mukul Roy instead of being taken home after his release."
156,2018-01-20T11:55:13+00:00,Kolkata24*7,"Kolkata: A woman lost her hand in an accident at AJC Bose Road. Two buses were racing at the time of the accident. Victim’s name is Shabana Akbar. The area of the accident comes under Karaya Police Station Area. The victim is now in an ICCU unit of a private hospital. The family has lodged a FIR at Shakespeare Sarani Police Station.According to the source, she was returning home after leaving her daughter for school. She was trying to cross the road; a bus pushed her back and squeezed her hand. Local residents rescued her and admitted to National Medical College. Due to her critical condition she has been sent to a private hospital. Reportedly, after a discussion with the family doctors took the decision to disbar the right hand.Police said, two buses of 230 routes were racing among them. Police has arrested the accused bus driver. Family has urged for proper punishment to the administration."
